{
  "schema": "sysml-ir/v1",
  "package": "CoaxialOctoRotor",
  "meta": {
    "title": "共轴八旋翼（X8）功率链标杆案例（需求 + 结构 + 参数 + 行为）",
    "source": "2610_MBSE 项目；《SysML建模智能体技术方案》7.3 标杆案例",
    "note": "T4 骨架范围：需求 + 结构 + 参数。二期补齐（2026-10-17）：行为——新增 1 个 StateDefinition（FlightModeStates 飞行模式状态机，5 状态 5 迁移）。v1 增补（2026-10-17）：Constraint（续航换算公式）与 Connection（电池→电调、上桨电机→上桨）。数值仍为占位示例值，非实测结论。"
  },
  "elements": [
    {
      "id": "REQ-MISSION-ENDURANCE",
      "kind": "Requirement",
      "name": "MissionEndurance",
      "owner": "CoaxialOctoRotor",
      "properties": {
        "text": "任务级续航：共轴八旋翼须按指定任务剖面完成起飞、巡航与安全返航。",
        "acceptanceCriteria": "在标称任务剖面（含 0.5 h 裕度）下，全程可用飞行时间 T_mission >= 5.0 h，且降落时电池剩余电量 >= 15%。",
        "verifyMethod": "simulation",
        "rationale": "任务书对滞空时长的总体要求，是下层续航需求的分解源头。",
        "priority": "high",
        "minMissionDurationHours": 5.0,
        "minLandingReserveFraction": 0.15
      },
      "relations": [
        {
          "type": "decomposes",
          "target": "REQ-CRUISE-ENDURANCE",
          "rationale": "任务级续航分解为巡航段的续航需求"
        },
        {
          "type": "satisfiedBy",
          "target": "PART-POWER-CHAIN",
          "rationale": "由功率链（电池→电调→电机→桨）的整体能量效率保障"
        }
      ]
    },
    {
      "id": "REQ-CRUISE-ENDURANCE",
      "kind": "Requirement",
      "name": "CruiseEndurance",
      "owner": "CoaxialOctoRotor",
      "properties": {
        "text": "巡航时间不低于 4 小时",
        "acceptanceCriteria": "在巡航速度 v 与转速比 eta 的稳态工作点下，满电续航时间 T >= 4.0 h",
        "verifyMethod": "simulation",
        "rationale": "任务剖面的巡航段占主要时长，单列为可验证条目。",
        "priority": "high",
        "minEnduranceHours": 4.0
      },
      "relations": [
        {
          "type": "refines",
          "target": "REQ-MISSION-ENDURANCE",
          "rationale": "由任务级续航需求分解而来"
        },
        {
          "type": "satisfiedBy",
          "target": "PART-BATTERY-PACK",
          "rationale": "由电池包可用能量与放电效率保障"
        }
      ]
    },
    {
      "id": "REQ-ROTOR-SPEED-RATIO",
      "kind": "Requirement",
      "name": "RotorSpeedRatioBand",
      "owner": "CoaxialOctoRotor",
      "properties": {
        "text": "在线寻优给出的上下桨转速比 eta 必须落在允许工作区间内。",
        "acceptanceCriteria": "对任意寻优输出满足 0.75 <= eta <= 1.25；且任一时刻任一桨的转速不超过其额定上限。",
        "verifyMethod": "simulation",
        "rationale": "转速比过小或过大会使共轴双桨进入气动干涉区，效率骤降并加剧振动。",
        "priority": "high",
        "minSpeedRatio": 0.75,
        "maxSpeedRatio": 1.25,
        "maxRotorSpeedRpm": 6200.0
      },
      "relations": [
        {
          "type": "refines",
          "target": "REQ-CRUISE-ENDURANCE",
          "rationale": "转速比区间是达成巡航续航的技术手段约束"
        },
        {
          "type": "satisfiedBy",
          "target": "ACT-ONLINE-OPTIMIZATION",
          "rationale": "由在线功率优化功能在寻优时施加区间约束"
        }
      ]
    },
    {
      "id": "REQ-POWER-BUDGET",
      "kind": "Requirement",
      "name": "CruisePowerBudget",
      "owner": "CoaxialOctoRotor",
      "properties": {
        "text": "巡航稳态下整机电功率不超过电池可持续放电功率上限。",
        "acceptanceCriteria": "P_cruise <= 0.9 * P_batt_max，其中 P_batt_max 为电池包持续放电功率额定值。",
        "verifyMethod": "analysis",
        "rationale": "功率超限会同时破坏续航与电池寿命。",
        "priority": "medium",
        "maxCruisePowerW": 260.0,
        "batteryDeratingFactor": 0.9
      },
      "relations": [
        {
          "type": "refines",
          "target": "REQ-CRUISE-ENDURANCE",
          "rationale": "功率预算是续航指标的能量侧约束"
        },
        {
          "type": "satisfiedBy",
          "target": "PART-POWER-CHAIN",
          "rationale": "由功率链各环节的效率与选型共同保障"
        }
      ]
    },
    {
      "id": "PART-STRUCT-SYSTEM",
      "kind": "PartDefinition",
      "name": "CoaxialOctoRotorSystem",
      "owner": "CoaxialOctoRotor",
      "properties": {
        "description": "共轴八旋翼整机系统（X8）：四根机臂，每臂上下两副桨共轴叠放。"
      },
      "relations": [
        {
          "type": "decomposes",
          "target": "PART-POWER-CHAIN",
          "rationale": "整机在结构上分解为功率链等子系统"
        }
      ]
    },
    {
      "id": "PART-POWER-CHAIN",
      "kind": "PartDefinition",
      "name": "PowerChain",
      "owner": "CoaxialOctoRotor",
      "properties": {
        "description": "功率链：电池 → 电调 → 电机 → 桨；上下桨各占一条并联支路。"
      }
    },
    {
      "id": "PART-BATTERY-PACK",
      "kind": "PartDefinition",
      "name": "BatteryPack",
      "owner": "CoaxialOctoRotor",
      "properties": {
        "description": "动力锂电池包，为整机提供能量。"
      }
    },
    {
      "id": "PART-ESC",
      "kind": "PartDefinition",
      "name": "ElectronicSpeedController",
      "owner": "CoaxialOctoRotor",
      "properties": {
        "description": "电子调速器，把电池直流电按转速指令调制后驱动电机。"
      }
    },
    {
      "id": "PART-MOTOR",
      "kind": "PartDefinition",
      "name": "BrushlessMotor",
      "owner": "CoaxialOctoRotor",
      "properties": {
        "description": "无刷直流电机，把电功率转换为轴功率。"
      }
    },
    {
      "id": "PART-PROP-UPPER",
      "kind": "PartDefinition",
      "name": "UpperRotor",
      "owner": "CoaxialOctoRotor",
      "properties": {
        "description": "共轴对的上桨，转速为上桨转速 n_upper。"
      }
    },
    {
      "id": "PART-PROP-LOWER",
      "kind": "PartDefinition",
      "name": "LowerRotor",
      "owner": "CoaxialOctoRotor",
      "properties": {
        "description": "共轴对的下桨，转速为下桨转速 n_lower。"
      }
    },
    {
      "id": "PART-USAGE-SYSTEM",
      "kind": "PartUsage",
      "name": "x8System",
      "owner": "CoaxialOctoRotor",
      "properties": {
        "typeRef": "PART-STRUCT-SYSTEM",
        "quantity": 1,
        "description": "本架共轴八旋翼的顶层实例（模型中唯一一份整机）。"
      },
      "relations": [
        {
          "type": "satisfiedBy",
          "target": "REQ-MISSION-ENDURANCE",
          "rationale": "整机实例承载任务级续航需求"
        }
      ]
    },
    {
      "id": "PART-USAGE-POWER-CHAIN",
      "kind": "PartUsage",
      "name": "powerChain",
      "owner": "PART-STRUCT-SYSTEM",
      "properties": {
        "typeRef": "PART-POWER-CHAIN",
        "quantity": 1,
        "description": "整机中功率链的那一份实例。"
      }
    },
    {
      "id": "PART-USAGE-BATTERY",
      "kind": "PartUsage",
      "name": "batteryPack",
      "owner": "PART-POWER-CHAIN",
      "properties": {
        "typeRef": "PART-BATTERY-PACK",
        "quantity": 1,
        "description": "功率链电源端。"
      },
      "relations": [
        {
          "type": "connects",
          "target": "PART-USAGE-ESC",
          "rationale": "电池直流母线馈入八路电调"
        }
      ]
    },
    {
      "id": "PART-USAGE-ESC",
      "kind": "PartUsage",
      "name": "escUnit",
      "owner": "PART-POWER-CHAIN",
      "properties": {
        "typeRef": "PART-ESC",
        "quantity": 8,
        "description": "八路电调，每副桨一路。"
      },
      "relations": [
        {
          "type": "connects",
          "target": "PART-USAGE-MOTOR-UPPER",
          "rationale": "电调按转速指令驱动上桨电机"
        },
        {
          "type": "connects",
          "target": "PART-USAGE-MOTOR-LOWER",
          "rationale": "同一路电调的另一支路驱动下桨电机"
        }
      ]
    },
    {
      "id": "PART-USAGE-MOTOR-UPPER",
      "kind": "PartUsage",
      "name": "upperMotor",
      "owner": "PART-POWER-CHAIN",
      "properties": {
        "typeRef": "PART-MOTOR",
        "quantity": 4,
        "description": "四根机臂上的上桨电机。"
      },
      "relations": [
        {
          "type": "connects",
          "target": "PART-USAGE-PROP-UPPER",
          "rationale": "上桨电机把轴功率传给上桨"
        }
      ]
    },
    {
      "id": "PART-USAGE-MOTOR-LOWER",
      "kind": "PartUsage",
      "name": "lowerMotor",
      "owner": "PART-POWER-CHAIN",
      "properties": {
        "typeRef": "PART-MOTOR",
        "quantity": 4,
        "description": "四根机臂上的下桨电机。"
      },
      "relations": [
        {
          "type": "connects",
          "target": "PART-USAGE-PROP-LOWER",
          "rationale": "下桨电机把轴功率传给下桨"
        }
      ]
    },
    {
      "id": "PART-USAGE-PROP-UPPER",
      "kind": "PartUsage",
      "name": "upperPropeller",
      "owner": "PART-POWER-CHAIN",
      "properties": {
        "typeRef": "PART-PROP-UPPER",
        "quantity": 4
      }
    },
    {
      "id": "PART-USAGE-PROP-LOWER",
      "kind": "PartUsage",
      "name": "lowerPropeller",
      "owner": "PART-POWER-CHAIN",
      "properties": {
        "typeRef": "PART-PROP-LOWER",
        "quantity": 4
      }
    },
    {
      "id": "CONN-BATTERY-ESC",
      "kind": "Connection",
      "name": "batteryToEsc",
      "owner": "PART-POWER-CHAIN",
      "properties": {
        "sourceRef": "PART-USAGE-BATTERY",
        "targetRef": "PART-USAGE-ESC",
        "flowKind": "electrical",
        "description": "电池直流母线馈入八路电调。"
      }
    }
  ]
}
